{
  "id": "polonia-org-razem-utah",
  "country": "US",
  "category": "organization",
  "name": "Razem Utah",
  "aliases": [],
  "status": "active",
  "location": {
    "address": null,
    "city": "Salt Lake City",
    "state": "UT",
    "postal_code": null,
    "latitude": null,
    "longitude": null
  },
  "phone": null,
  "email": null,
  "website": null,
  "languages": [
    "pl",
    "en"
  ],
  "services": [
    "Polish community and cultural organization in Utah"
  ],
  "coverage_area": [
    "UT"
  ],
  "notes": [
    "Listed by the Embassy of the Republic of Poland among Polish institutions operating in the United States; local program/contact details should be periodically refreshed."
  ],
  "official_source": "https://www.gov.pl/web/usa/relacje-dwustronne",
  "last_verified": "2026-09-30"
}
