{
  "id": "polonia-business-pierogi-kitchen-chicago",
  "country": "US",
  "category": "restaurant",
  "name": "Pierogi Kitchen",
  "aliases": [],
  "status": "active",
  "location": {
    "address": "1856 W North Ave",
    "city": "Chicago",
    "state": "IL",
    "postal_code": "60622",
    "latitude": null,
    "longitude": null
  },
  "phone": "+1 773-799-8273",
  "email": null,
  "website": "https://pierogikitchen.com/",
  "languages": [
    "pl",
    "en"
  ],
  "services": [
    "Polish cuisine",
    "dine-in/takeout"
  ],
  "coverage_area": [
    "Chicago",
    "IL"
  ],
  "notes": [
    "Commercial directory record. Business status, address, hours and services are freshness-sensitive and should be periodically reverified."
  ],
  "official_source": "https://pierogikitchen.com/",
  "last_verified": "2026-09-30"
}
