{
  "id": "polonia-business-hetman-deli-ridgewood",
  "country": "US",
  "category": "store",
  "name": "Hetman Polish Deli",
  "aliases": [],
  "status": "active",
  "location": {
    "address": "66-51 Fresh Pond Rd",
    "city": "Ridgewood",
    "state": "NY",
    "postal_code": "11385",
    "latitude": null,
    "longitude": null
  },
  "phone": "+1 718-456-5222",
  "email": null,
  "website": null,
  "languages": [
    "pl",
    "en"
  ],
  "services": [
    "Polish and European groceries",
    "deli/specialty foods"
  ],
  "coverage_area": [
    "Ridgewood",
    "NY"
  ],
  "notes": [
    "Commercial directory record; status, address, hours and services are freshness-sensitive and should be periodically reverified."
  ],
  "official_source": "https://www.gov.pl/web/usa/relacje-dwustronne",
  "last_verified": "2026-09-30"
}
