{
  "id": "polonia-credit-union-psfcu-copiague-ny",
  "country": "US",
  "category": "credit_union",
  "name": "Polish & Slavic Federal Credit Union - Copiague",
  "status": "active",
  "location": {
    "address": "314 Great Neck Road",
    "city": "Copiague",
    "state": "NY",
    "postal_code": "11726",
    "latitude": null,
    "longitude": null
  },
  "languages": [
    "pl",
    "en"
  ],
  "services": [
    "checking and savings",
    "consumer loans",
    "mortgages",
    "credit and debit cards",
    "online banking",
    "member financial services"
  ],
  "phone": "+1 631-957-0573",
  "email": null,
  "website": "https://www.psfcu.com/",
  "official_source": "https://www.psfcu.com/our_branches",
  "last_verified": "2026-09-30",
  "notes": [
    "Official PSFCU branch list confirms this physical branch. PSFCU directly documents its mission/history serving Polish and Slavic immigrant communities."
  ]
}
