{
  "id": "polonia-school-kosciuszko-chicago-il",
  "country": "US",
  "category": "polish_school",
  "name": "Polska Szkoła im. Tadeusza Kościuszki",
  "aliases": [],
  "status": "active",
  "location": {
    "address": "5341 N Harlem Ave",
    "city": "Chicago",
    "state": "IL",
    "postal_code": "60656",
    "latitude": null,
    "longitude": null
  },
  "phone": null,
  "email": null,
  "website": null,
  "languages": [
    "pl",
    "en"
  ],
  "services": [
    "Polish supplementary education"
  ],
  "coverage_area": [
    "IL"
  ],
  "notes": [
    "Listed in the ORPEG Polonia-school database; current enrollment/contact details should be reconfirmed directly with the school."
  ],
  "official_source": "https://archiwum.orpeg.gov.pl/db/web/database/115?page=17&queryString=",
  "last_verified": "2026-09-30"
}
